### ISSUE TITLE
K3OS releases after v0.11.1 fail to get DHCP-assigned address from dnsmasq

### ISSUE THREAD

**Issue by TechnoTaff** [rancher/k3os#685]
**Version (k3OS / kernel)**
k3os version v0.20.4-k3s1r0

**Architecture**
x86_64

**Describe the bug**
DHCP was working well for me with versions up to and including v0.11.1. Upon upgrade to newer releases I am no longer able to get a DHCP lease from my DNSMasq server.

**To Reproduce**
k3os options:
```
k3os:
  data_sources:
  - cdrom
  modules:
  - kvm
  sysctl:
    kernel.printk: "4 4 1 7"
    kernel.kptr_restrict: "1"
  dns_nameservers:
  - 192.168.x.254
  ntp_servers:
  - 192.168.x.254
  password: rancher
  server_url: https://192.168.x.99:6443
  token: <redacted>
  labels:
    k3os.io/upgrade: enabled
  k3s_args:
  - agent
ssh_authorized_keys:
 - <redacted>
hostname: k3s-client1
```

**Expected behavior**
Prior to this release DHCP was working, if I revert to old version it works with no changes.

**Actual behavior**
connman debug output:
```
$ grep -i "daemon.debug connmand" /var/log/messages | grep -i dhcp
Apr 23 09:41:41 k3s-handbills daemon.debug connmand[3467]: src/network.c:set_connected_dhcp() network 0x556ab61448e0
Apr 23 09:41:41 k3s-handbills daemon.debug connmand[3467]: src/dhcp.c:__connman_dhcp_start() 
Apr 23 09:41:41 k3s-handbills daemon.debug connmand[3467]: src/ipconfig.c:__connman_ipconfig_ref_debug() 0x556ab61455a0 ref 3 by src/dhcp.c:702:__connman_dhc
p_start()
Apr 23 09:41:41 k3s-handbills daemon.debug connmand[3467]: src/network.c:connman_network_ref_debug() 0x556ab61448e0 name Wired ref 4 by src/dhcp.c:706:__conn
man_dhcp_start()
Apr 23 09:41:41 k3s-handbills daemon.debug connmand[3467]: src/dhcp.c:dhcp_initialize() dhcp 0x556ab6145ee0
Apr 23 09:41:45 k3s-handbills daemon.debug connmand[3467]: src/network.c:check_dhcpv6() reply 0
Apr 23 09:41:45 k3s-handbills daemon.debug connmand[3467]: src/network.c:check_dhcpv6() re-send router solicitation 3
Apr 23 09:41:49 k3s-handbills daemon.debug connmand[3467]: src/network.c:check_dhcpv6() reply 0
Apr 23 09:41:49 k3s-handbills daemon.debug connmand[3467]: src/network.c:check_dhcpv6() re-send router solicitation 2
Apr 23 09:41:53 k3s-handbills daemon.debug connmand[3467]: src/network.c:check_dhcpv6() reply 0
Apr 23 09:41:53 k3s-handbills daemon.debug connmand[3467]: src/network.c:check_dhcpv6() re-send router solicitation 1
Apr 23 09:41:57 k3s-handbills daemon.debug connmand[3467]: src/network.c:check_dhcpv6() reply 0
Apr 23 09:41:57 k3s-handbills daemon.debug connmand[3467]: src/network.c:connman_network_unref_debug() 0x556ab61448e0 name Wired ref 4 by src/network.c:766:c
heck_dhcpv6()
Apr 23 09:42:11 k3s-handbills daemon.debug connmand[3467]: src/dhcp.c:no_lease_cb() No lease available ipv4ll 0 client 0
Apr 23 09:42:11 k3s-handbills daemon.debug connmand[3467]: src/dhcp.c:dhcp_invalidate() dhcp 0x556ab6145ee0 callback 0
Apr 23 09:42:11 k3s-handbills daemon.debug connmand[3467]: src/dhcp.c:dhcp_invalidate() last address (null)
```
**Additional context**
tcpdump of DHCP conversation:
```
sudo tcpdump -i ens9 port bootps
tcpdump: verbose output suppressed, use -v or -vv for full protocol decode
listening on ens9, link-type EN10MB (Ethernet), capture size 262144 bytes
09:45:18.089844 IP 0.0.0.0.bootpc > 255.255.255.255.bootps: BOOTP/DHCP, Request from 52:54:00:6c:00:00 (oui Unknown), length 548
09:45:18.090332 IP 192.168.x.254.bootps > 192.168.x.99.bootpc: BOOTP/DHCP, Reply, length 303
09:45:23.089495 IP 0.0.0.0.bootpc > 255.255.255.255.bootps: BOOTP/DHCP, Request from 52:54:00:6c:00:00 (oui Unknown), length 548
09:45:23.089753 IP 192.168.x.254.bootps > 255.255.255.255.bootpc: BOOTP/DHCP, Reply, length 303
09:45:23.521873 IP 0.0.0.0.bootpc > 255.255.255.255.bootps: BOOTP/DHCP, Request from 52:54:00:0d:de:fc (oui Unknown), length 548
09:45:26.831541 IP 192.168.x.254.bootps > 192.168.x.146.bootpc: BOOTP/DHCP, Reply, length 303
09:45:28.089649 IP 0.0.0.0.bootpc > 255.255.255.255.bootps: BOOTP/DHCP, Request from 52:54:00:6c:00:00 (oui Unknown), length 548
09:45:28.090301 IP 192.168.x.254.bootps > 192.168.x.99.bootpc: BOOTP/DHCP, Reply, length 303
09:45:28.539252 IP 0.0.0.0.bootpc > 255.255.255.255.bootps: BOOTP/DHCP, Request from 52:54:00:0d:de:fc (oui Unknown), length 548
09:45:28.539612 IP 192.168.x.254.bootps > 255.255.255.255.bootpc: BOOTP/DHCP, Reply, length 303
09:45:33.089488 IP 0.0.0.0.bootpc > 255.255.255.255.bootps: BOOTP/DHCP, Request from 52:54:00:6c:00:00 (oui Unknown), length 548
09:45:33.089827 IP 192.168.x.254.bootps > 255.255.255.255.bootpc: BOOTP/DHCP, Reply, length 303
09:45:33.537809 IP 0.0.0.0.bootpc > 255.255.255.255.bootps: BOOTP/DHCP, Request from 52:54:00:0d:de:fc (oui Unknown), length 548
09:45:33.538107 IP 192.168.x.254.bootps > 192.168.x.146.bootpc: BOOTP/DHCP, Reply, length 303
09:45:38.089781 IP 0.0.0.0.bootpc > 255.255.255.255.bootps: BOOTP/DHCP, Request from 52:54:00:6c:00:00 (oui Unknown), length 548
09:45:38.089945 IP 192.168.x.254.bootps > 192.168.x.99.bootpc: BOOTP/DHCP, Reply, length 303
```

dnsmasq journalctl:
```
Apr 23 09:47:35 bobafett dnsmasq-dhcp[198012]: DHCPDISCOVER(ens9) 52:54:00:f3:fb:75
Apr 23 09:47:35 bobafett dnsmasq-dhcp[198012]: DHCPOFFER(ens9) 192.168.200.111 52:54:00:f3:fb:75
Apr 23 09:47:40 bobafett dnsmasq-dhcp[198012]: DHCPDISCOVER(ens9) 52:54:00:f3:fb:75
Apr 23 09:47:40 bobafett dnsmasq-dhcp[198012]: DHCPOFFER(ens9) 192.168.200.111 52:54:00:f3:fb:75
Apr 23 09:47:45 bobafett dnsmasq-dhcp[198012]: DHCPDISCOVER(ens9) 52:54:00:f3:fb:75
Apr 23 09:47:45 bobafett dnsmasq-dhcp[198012]: DHCPOFFER(ens9) 192.168.200.111 52:54:00:f3:fb:75
Apr 23 09:47:50 bobafett dnsmasq-dhcp[198012]: DHCPDISCOVER(ens9) 52:54:00:f3:fb:75
Apr 23 09:47:50 bobafett dnsmasq-dhcp[198012]: DHCPOFFER(ens9) 192.168.200.111 52:54:00:f3:fb:75
Apr 23 09:47:55 bobafett dnsmasq-dhcp[198012]: DHCPDISCOVER(ens9) 52:54:00:f3:fb:75
Apr 23 09:47:55 bobafett dnsmasq-dhcp[198012]: DHCPOFFER(ens9) 192.168.200.111 52:54:00:f3:fb:75
```

**Things I have tried**
 * disabling ipv6
   ```
   connmanctl services ethernet_5254000ddefc_cable
  /net/connman/service/ethernet_5254000ddefc_cable
  Type = ethernet
  Security = [  ]
  State = ready
  Favorite = True
  Immutable = False
  AutoConnect = True
  Name = Wired
  Ethernet = [ Method=auto, Interface=eth0, Address=52:54:00:0D:DE:FC, MTU=1500 ]
  IPv4 = [ Method=auto, Address=169.254.51.145, Netmask=255.255.0.0 ]
  IPv4.Configuration = [ Method=auto ]
  IPv6 = [  ]
  IPv6.Configuration = [ Method=auto, Privacy=disabled ]
  Nameservers = [ 192.168.x.254 ]
  Nameservers.Configuration = [  ]
  Timeservers = [ 192.168.x.254 ]
  Timeservers.Configuration = [  ]
  Domains = [  ]
  Domains.Configuration = [  ]
  Proxy = [ Method=direct ]
  Proxy.Configuration = [  ]
  mDNS = False
  mDNS.Configuration = False
  Provider = [  ]
```

**Comment by TechnoTaff** [comment]
I've done some more work on this issue, it definitely appears to be dnsmasq-specific. Replacing the DHCP server on this network segment with ISC DHCPd results in working nodes. I've done some tracing of the DHCP DISCOVERY and OFFER, trying to get the DNSMasq OFFER to be the same as that offered by ISC.

I've got the difference down to DHCP options 58 and 59, which are offered by DNSMasq but not ISC, and there is no way of disabling those options.

For now I have implemented a workaround by running both DHCP servers on my network device and limiting ISC to the segment running K3OS.

**Comment by dweomer** [comment]
@TechnoTaff please re-open if you think there is something that k3OS can do to fix this for others that may run into it.
